{"entries":[{"channel":"stable","content":{"length":1115,"path":"packs/sha256-71cdbec6d7450b05d88f7f13cc7e1f66b98be2824846b526d358fef644d94e59.json","sha256":"71cdbec6d7450b05d88f7f13cc7e1f66b98be2824846b526d358fef644d94e59"},"metadata":{"delegatedTargets":{"length":961,"path":"metadata/standards-stable.json","sha256":"747a5bc3972196950bb2f761940a4ff4d6a5a0076f19df2339d2ca409a3579e3"},"root":{"length":2948,"path":"metadata/root.json","sha256":"b70902332ebf7783046f63601477f147957c10b9f67db4eec2544e2b92f39060"},"snapshot":{"length":864,"path":"metadata/snapshot.json","sha256":"6b21618b3d0835d29a14c62444c6eba5bf85dbab536f50d1e68beeb33b827a36"},"targets":{"length":2489,"path":"metadata/targets.json","sha256":"375b8e3de220f01a39075d109aa0bb3e7765d9151a5b1e98ff92e3d5c04cb09a"},"timestamp":{"length":588,"path":"metadata/timestamp.json","sha256":"869622968a71e12cb60b27764ad6162aeca81fb421e0a637392c08ed37de2529"}},"targetPath":"knowledge/stable/agent-context-bundled.json"}],"recordKind":"agent-context-bundled-pack-manifest","schemaVersion":"0.1.0","verificationTime":"2026-08-02T12:00:00Z"}